Name,Manufacturer,Serial Number,Category,Purchase Date,Purchase Cost,Location,Company,Order Number,Quantity,Notes,Model Number,Min Qty,Supplier
Pineapple Salsa,Tavu,,Books,2025-02-07,4.29,Karanganyar,"Cruickshank, Wolf and Mertz",21320,120,,A warm and stylish puffer coat perfect for winter weather.,48,Livetube
Pumpkin Spice Muffins,Aivee,14ac11af-7710-4089-9917-01f39aee770f,Jewelry,2026-02-16,3.99,,Crona and Sons,56362,292,Moist and flavorful muffins packed with fall spices and pumpkin puree.,"Smooth soup made from carrots and ginger, great for cold days.",53,Yabox
Pet Safety Belt for Car,Linkbridge,f79eae8e-7744-4011-9b07-8d578ad03367,Electronics,2026-01-19,,Mambi,"Johns, Wisozk and Botsford",16247,277,Seat belt attachment to keep dogs safe during car rides.,A blend of dried Italian herbs for cooking.,286,Thoughtblab
Hiking Boots,Quire,78791939-3b89-4d23-94e5-baad81db0e6d,Home,2025-10-10,79.99,,,,185,Comfortable hiking boots for outdoor adventures.,Savory sausage links with a hint of maple flavor.,289,Rhynyx
Hair Dryer,Realmix,a5963ce0-0aad-46cf-a05a-9734aae40ea0,Tools,2025-11-11,39.99,Fazenda de Santa Cruz,,81685,267,Compact hair dryer with multiple heat settings.,,,Tavu
Bamboo Bathtub Caddy,Ailane,071f4e9d-b51a-4b5d-8bd9-8d0051d9cf9a,Outdoors,2025-08-06,34.99,Vale,,70566,11,"Expandable caddy for holding books, phones, and snacks while in the bath.",Spicy chili sauce for an extra kick in your meals.,90,Midel
Cinnamon Rolls,Youbridge,,Clothing,2025-11-26,4.49,,Hilll-Altenwerth,18065,255,"Sweet and gooey cinnamon rolls, ready to bake.",Sweet and tangy raspberry lime beverage,221,Lajo
Laptop Stand,Tavu,aab995a7-f72e-485e-9ac2-9e55094c7884,Kids,2025-12-03,29.99,San Carlos,Borer-McCullough,56827,50,Adjustable laptop stand for better ergonomics.,,57,Vipe
Classic Slim Fit Shirt,Realpoint,1f27b4cf-6a6c-4793-b58d-d711dea228ba,Electronics,2025-02-16,49.99,Ikedachō,"Wunsch, Crona and Witting",,225,A tailored slim fit shirt for a polished look at work.,"Frozen green peas, a great addition to meals.",37,Kazio
Knitted Infinity Scarf,Topicshots,990b6cf0-d726-496b-b372-cca9c8726f3d,Automotive,2025-04-10,,,,,210,A warm knitted scarf to keep you cozy in winter.,"Synthetic crab meat sticks, great for salads and sushi.",216,
Buttermilk Pancakes,Gabspot,cdb2aa08-0806-4a73-9306-490a605c1cf3,Home,2025-06-13,3.99,Pakemitan,,53137,238,Fluffy pancakes with buttermilk flavor.,Creamy ice cream with refreshing mint flavor and chocolate chips.,,Yambee
Smashed Avocado with Lime,Skipstorm,fc5c13fe-669c-4b3e-bcc2-bbac7c4e1d7b,Jewelry,2025-12-08,2.49,Maumbawa,Smith Group,,69,"A creamy blend of avocados and lime juice, great for spreads or dips.",Delicious ravioli filled with creamy ricotta and fresh spinach.,216,Skyba
Sweet Potatoes (organic),Jabbersphere,7b6ab85c-95a5-4e3c-bdf8-b4334bb9f446,Tools,2025-06-03,,Burunday,Sanford and Sons,34025,272,"Fresh organic sweet potatoes, great for roasting or mashing.",Space-saving shoe organizer for tight spaces.,246,Gigazoom
Fridge Magnet Set,Kazio,d12a08b7-f124-4837-bb10-4ea66345d5b7,Movies,2025-03-01,15.99,Pacaembu,,14797,262,Fun fridge magnets to decorate your kitchen.,Durable and spacious backpack for travel and school.,246,Zooxo
Luxe Velvet Blazer,Pixope,b5b87120-255f-41fb-b522-f84c31dfa814,Tools,2025-12-24,89.99,Xianlin,Kessler Inc,88521,297,Elevate your outfit with this sophisticated velvet blazer.,Easy meal kit for creamy fettuccine Alfredo.,281,Gabtune
Applewood Smoked Bacon,Babbleset,67ba0af5-88d6-4a0c-b535-4fde3bca4410,Outdoors,2025-12-02,6.99,,Nader-Parisian,,169,,Spreadable cream cheese with garlic and herbs.,283,Zoozzy
Teriyaki Chicken Wings,Avavee,e3a6afde-6a50-4018-896a-8a1646e860c7,Movies,2025-12-23,10.99,,,4592,203,Flavorful chicken wings marinated in a sweet teriyaki glaze.,Rechargeable water flosser for dental hygiene.,116,Yabox
Waterproof Rain Boots,Kazio,,Grocery,2025-11-16,69.99,Jingxi,,68401,48,Stay dry with these stylish waterproof rain boots.,,67,Twitterbridge
Cranberry Pecan Granola,Avamba,384c234f-7c64-4c42-9bfa-93c00bf21eb0,Outdoors,2026-01-29,3.99,,Jast Inc,,19,Crunchy granola with cranberries and pecans.,Flavored aioli made with roasted garlic,151,
Training Soccer Ball,,c8211df4-1ddc-46eb-8014-6f8a9953fa14,Outdoors,2025-03-28,19.99,Karangtengah,Pacocha-Dach,11934,123,Durable training soccer ball for practice.,3D model puzzle kit for creative builders.,91,Cogidoo
Car Vacuum Cleaner,Fadeo,a413e8a4-5144-4f18-8c7a-a48839bee9ce,Music,2025-12-08,39.99,Khulm,,58996,99,,"All-in-one tool for measuring soil moisture, light, and pH.",291,Wikivu
Chicken Breasts,Buzzster,6b12ec1e-6ffd-462e-b21e-fbfcd0842034,Health,2025-02-07,,,Dach-Hand,58354,158,Juicy and tender boneless chicken breasts.,A flowy maxi dress perfect for both casual and semi-formal occasions.,,Talane
Crafting Kit,Meejo,109546cb-6de1-4377-88bd-8b710ea5ac02,Computers,2025-09-07,29.99,Pomacocha,Oberbrunner-Hagenes,,300,Complete crafting kit for kids and adults.,Chewy bars made with peanut butter and chocolate chips.,,Oyope
Gardening Gloves with Claws,BlogXS,0828c19d-3d3d-4cbb-97de-096ac658a08f,Kids,2025-05-31,,Lago,"Reynolds, Green and Witting",42922,21,Durable gloves with built-in claws for digging and planting.,Water bottle that tracks your hydration levels.,,Gabspot
Sourdough Bread,Twitterworks,9733fd8e-d3be-4dca-9f64-aab4cbad8c6c,Music,2025-07-07,,Ban Bueng,,,216,Artisan-made sourdough bread with a tangy flavor.,Compact USB fan for personal cooling.,,Vipe
Garden Hose,Pixoboo,e9a5361b-4adb-4b9f-b5b0-d1d25f860f68,Shoes,2025-02-06,32.99,Tonekābon,Armstrong LLC,58646,270,Durable 50-foot garden hose with nozzle.,Color-changing LED lights for home decoration with remote.,86,Edgeclub
Pineapple Salsa,Eire,3afd3a29-06ab-4936-bac1-ccad4fb83844,Industrial,2026-01-13,4.29,Cisaro,,48983,50,Fresh salsa made with pineapple and spices,"A fresh, flavorful basil pesto for pasta and more",147,Youfeed
Smart Air Purifier,Lazz,a1fd6a70-88f6-41c6-b62e-7a9a19f1989f,Outdoors,2025-02-14,199.99,Potštát,,1130,184,Filters allergens and pollutants from the air for a healthier home.,"Fine semolina flour, perfect for pasta and desserts.",46,Vitz
Almond Joy Snack Bars,Youspan,730e004b-bb34-4f89-8d98-e838de16415c,Computers,2025-01-04,2.99,Oekero,,,12,Chewy snack bars with coconut and almonds coated in chocolate.,Effective laundry detergent for a deep clean.,160,Twinder
Cocktail Shaker Set,Eare,ad2fd546-1222-4ba7-a597-c6ef9a9e5e51,Electronics,2025-02-19,29.99,,,45646,212,"Bartender kit with shaker, jigger, and strainer.","Fluffy couscous seasoned with a blend of herbs, perfect as a side dish.",142,Jetwire
Foldable Yoga Mat,Zoomdog,f84f5c9f-b9d8-4c02-9e6e-f26a23a12881,Games,2025-10-29,,Ribeira do Pombal,"Bernier, Skiles and Kessler",39423,284,Compact yoga mat that folds for easy storage and transport.,,68,Cogibox
Travel Orthopedic Pillow,Kwimbee,77d23e71-0214-4f98-b274-316c8df62b75,Movies,2025-06-29,24.99,Chlumčany,,5263,21,Supportive pillow that provides comfort while traveling.,Convert your desk to a standing desk easily.,,Twitternation
Smartphone Tripod,Chatterbridge,7b8f0836-c526-4ed5-8bce-f796baefe244,Garden,2025-12-22,29.99,Karmai,Smith Group,,8,Adjustable tripod for smartphones and cameras.,,57,Quire
Sweet Potato Noodles,Buzzdog,bbb3172e-736e-496f-b3e1-41f9a7c773bc,Movies,2025-08-31,3.79,Armenia,"Pfannerstill, Howe and Jaskolski",17259,199,"Pasta alternative made from sweet potatoes, gluten-free and rich in flavor.",,136,Jaxbean
Smart Home Security Camera,Zava,,Jewelry,2025-05-11,79.99,Gusang,Mraz and Sons,67775,206,Wi-Fi camera with motion detection for home security.,Shower head designed for a strong spray and complete coverage.,,Brightbean
Adjustable Laptop Stand,Photospace,417e3f46-e949-4c82-96d1-ec0561dca7c4,Beauty,2025-08-21,,,Cruickshank-Mitchell,6403,78,Ergonomic stand for laptops to improve posture while working.,Fresh and crunchy baby carrots ready for snacking.,111,Linkbuzz
Cauliflower Pizza Crust,Browsetype,6b6012eb-06be-4ed2-a4b7-27c8ef9c2492,Beauty,2025-07-04,,Bang Pahan,"Anderson, Breitenberg and Kshlerin",,255,Healthy pizza crust made from cauliflower,"Creamy, dairy-free Alfredo sauce",93,Chatterpoint
Camping Tarp,Meejo,b671421b-769f-4bd2-8cd2-a78d08e63eb0,Health,2025-10-22,32.99,Mulifanua,"Douglas, Von and Orn",79212,262,Durable tarp for outdoor camping and protection.,"Supportive sports bra designed for high-impact workouts, made with moisture-wicking fabric.",44,Abatz
Silicone Stretch Lids,Skiptube,f65a52e7-1f55-4ef1-b930-5bcd2b93c145,Toys,2025-04-09,14.99,Carazinho,,19972,23,Reusable silicone lids for covering food in bowls and storage containers.,Golden-brown fritters made with sweet corn.,230,Tagopia
Pet Leash,Kwimbee,68bfd50f-3007-463c-9a8e-1d66678a725e,Tools,2026-01-25,15.99,Petaluma,"Reilly, Hayes and Boehm",,79,Durable pet leash with comfortable handle.,"Grape leaves stuffed with rice and herbs, ready to eat.",144,Thoughtstorm
Canvas Wall Art,Camido,047d37ce-923f-471d-9725-d78c97149850,Tools,2025-03-20,39.99,Baixi,"Boehm, Feest and Beier",,268,,Wireless earbuds designed for immersive sound experience.,129,Dazzlesphere
Spicy Vegetable Sushi Rolls,Katz,668e87d7-a2f6-42b3-b190-0892bd3c2d97,Baby,2026-01-21,8.49,,"Bailey, Bradtke and Reinger",45203,133,Vegan sushi filled with spicy vegetables and avocado.,Complete watercolor set with paints and brushes.,70,
Key Finder,Yakitri,,Outdoors,2025-02-24,19.99,Sungaipuntik,Hilll-Bahringer,51321,227,Bluetooth-enabled key tracker to find lost items easily.,Refreshing cranberry juice with no added sugar.,297,Voonte
Blueberry Chia Jam,Dazzlesphere,c1ae15a0-b9e5-4f03-bddf-1e706e1d1aad,Automotive,2025-12-03,4.99,Karlskrona,,53260,34,"Homemade jam made with blueberries and chia seeds, no added sugar.","Fresh zucchini, versatile for grilling or sautéing.",91,Rooxo
Italian Marinara Sauce,Jabbersphere,470a28aa-66c5-4651-92e4-f09e23dc5596,Shoes,2025-11-02,3.29,Ar Rawḑah,"Howell, Grady and Rutherford",60003,15,"Classic marinara sauce for pasta, pizza, or dipping.","Sweet bread with cinnamon and raisins, great for breakfast or snacks.",111,Zooxo
Adjustable Yoga Mat Strap,Zoombeat,e4f45101-f196-4217-b80b-6ff887324811,Industrial,2025-06-01,14.99,,Cummerata-Donnelly,,110,,Creamy almond butter sweetened with maple syrup for a delicious spread.,160,Bubblemix
Digital Wireless Camera,Shufflester,7190e3f7-2f13-44cb-a897-aaabb043701d,Books,2025-01-04,199.99,,Boehm and Sons,6053,240,Secure digital wireless security camera system.,"Non-stick griddle for pancakes, burgers, and more.",214,Youfeed
Toasted Coconut Granola,,0837526e-28d0-49a7-9b9d-a1cdbc3166cf,Books,2025-05-15,4.99,Batur Kidul,Ferry-Schowalter,92716,44,"Crunchy granola with toasted coconut flakes, perfect for breakfast or snacks.",Rechargeable LED camping lantern for outdoor use.,159,Youfeed
Lentil Vegetable Curry,Kayveo,c7d51b6b-7ea6-4366-bdce-e88124fee352,Books,2025-06-05,4.49,Tampa,O'Kon-Goodwin,16805,159,A flavorful lentil curry cooked with vegetables and spices.,Healthier way to make popcorn in the microwave without oil.,111,Tagpad
Couscous Mix,Ooba,,Outdoors,2025-09-01,2.49,Cimadang,Blick-Legros,,54,"Fluffy couscous that cooks in just minutes, perfect as a side.",Effective laundry detergent for a deep clean.,,Bubblemix
Luminous Night Light,Jayo,68185b62-3d91-4566-92fa-48cb02818fc0,Electronics,2025-03-19,15.99,Ouégoa,,89740,110,Soft glow night light for children's rooms or bedside.,Delicious mini donuts dusted with cinnamon sugar.,,Skippad
Sesame Noodles,Gigabox,,Health,2025-12-19,5.99,Curahpacul Satu,,2390,154,"Chilled noodles dressed in sesame sauce, ready to eat.",Storage solutions for keeping your car tidy and organized.,,Trilith
Kettle BBQ Grill,Feedfire,d2f2496e-157a-4883-9e4d-227270373e92,Beauty,2025-10-06,99.99,Mubo,"Hilpert, Dietrich and Walsh",52065,216,Charcoal kettle grill perfect for backyard barbecues.,"Crispy chips made from assorted garden vegetables, lightly salted.",253,Flashdog
Aeropress Coffee Maker,Kwimbee,0889ffc7-f39b-4e83-a4e2-d6f7b6a80256,Tools,2025-12-13,29.99,Alapayevsk,,78900,13,,Boost your Wi-Fi signal for better coverage.,231,Yodel
Crew Neck Sweater,Blogtag,ff84a650-7544-473c-a4f6-a82e5405b0e8,Shoes,2025-06-20,39.99,La Gi,Heaney-Ziemann,4145,69,"A comfortable crew neck sweater, great for all seasons.","Concentrated tomato paste, great for sauces.",155,Ooba
Bluetooth Headphones,Jaxnation,792b4941-04b4-44c2-a943-ac8b10afb153,Kids,2025-04-18,79.99,Hartford,"Daugherty, Mueller and Klein",51404,216,,"Crispy chicken bites, perfect for dipping.",125,Divavu
Compact Digital Camera,Buzzster,0b87046d-4c63-4d7c-91ce-8afee8ff4cd7,Music,2025-08-21,,,Senger LLC,,68,High-resolution camera for stunning photos.,Shower head designed for a strong spray and complete coverage.,111,Linktype
Orange Ginger Vinaigrette,Cogidoo,fa151557-e313-4df7-bfc9-15b1704cea68,Toys,2025-08-24,3.99,,,96917,288,Tangy vinaigrette with orange and ginger flavors.,Fast and convenient air pump for inflating toys and furniture.,,Wordware
Portable Folding Picnic Table,,,Beauty,2025-05-29,69.99,Souto da Casa,McDermott-King,50985,229,Easy-to-set-up picnic table for outdoor dining.,Safe and fun trampoline for children.,297,Wikizz
Plant-Based Protein Bars,Youspan,267b7933-2277-482a-951a-6e4673f25024,Grocery,2025-06-18,19.99,,"Brekke, Ortiz and Rice",55629,266,Nutritious protein bars for on-the-go snacking.,Heated stool cover for extra comfort during winter.,,
Ginger Turmeric Tea,Gigaclub,83651c27-fb11-4160-a69e-9f41019dcb9d,Sports,2025-07-07,3.49,Gunem,"Adams, O'Kon and Grady",88518,221,,Fresh organic blueberries perfect for snacking or baking.,137,Realpoint
Honey Lemon Tea,Riffpath,6ce3c549-3808-40fb-9cc8-dd7aae955798,Baby,2025-12-22,3.29,Azogues,Roob LLC,23740,201,,Stylish desk lamp featuring a USB charging port.,7,Twiyo
Peach Mango Smoothie Mix,Brightbean,a7fd4350-39be-468b-ada0-9bd07bc71225,Jewelry,2025-09-18,5.99,Jagabaya Dua,"Cronin, Will and Dooley",32221,248,A blend of peach and mango for a tropical smoothie.,,98,Oyondu
Vegetable Spiralizer,Kwimbee,,Shoes,2026-01-12,19.99,San Martín de los Andes,,2896,140,Create spiraled vegetable noodles easily for healthy meals.,Planters with a self-watering feature for easy care.,286,Jetwire
Children's Educational Workbook,Youopia,21d21919-99fb-4892-8022-a6c7dea4999f,Books,2025-06-25,12.99,Realeza,"Borer, Corkery and Gerlach",,24,Activity workbook for early learning and fun.,Compact and stylish indoor/outdoor fire pit for ambiance.,54,Chatterpoint
Peach Mango Smoothie Mix,Yozio,deedef19-1c8a-49e7-8855-f9ecdf552224,Games,2025-01-25,,Qiqing,Witting Group,,23,A blend of peach and mango for a tropical smoothie.,Spicy and flavorful curry paste for authentic Thai dishes.,86,Vidoo
Compressed Towel Tablets,,bffc1b5a-6c98-469f-815a-d39600845f70,Movies,2025-06-06,12.99,El Potrero,,,48,"Compact towels that expand when wet, ideal for travel.",A timeless wardrobe staple crafted from soft cotton with a perfect fit.,279,Buzzster
Pet Hair Removal Roller,Skinte,4067efd2-0d95-4e31-af1a-8a7941387235,Automotive,2026-01-24,10.99,Barra Mansa,"Moen, Mitchell and Thiel",71035,11,Lint roller designed specifically for removing pet hair from furniture.,Quick-cooking couscous flavored with herbs and spices.,286,Thoughtbridge
Kids' STEM Robotics Kit,Devcast,7c01b4a1-1955-4c2a-859f-dce47e0f01d0,Grocery,2025-10-09,59.99,Yichun,Abbott-Grady,78973,11,,"Lightweight cover-up perfect for the beach, with a breezy design.",290,Yakidoo
Wireless Charging Station,Skimia,,Shoes,2025-02-13,39.99,,,,33,Charge multiple devices with this sleek charging station.,Delicious bacon with a rich applewood smoked flavor.,14,Innotype
Handheld Vacuum,Thoughtmix,25def9f0-91cb-46d4-a406-996f79d8b402,Music,2026-02-07,79.99,,,18078,79,Cordless handheld vacuum for quick cleanups.,Therapeutic weighted blanket for better sleep.,52,Avamba
Pumpkin Waffles,Tazzy,5c57a6c5-d8e1-4859-b637-bd51c86393ea,Books,2025-07-16,4.49,Seattle,,,55,Delicious waffles infused with pumpkin and spices.,,163,Ntags
Walnut Halves,Voolia,afa3db1f-da92-4395-94db-82b4c8c3ddf2,Movies,2025-02-20,8.49,Nova Kakhovka,,24984,80,Fresh walnut halves for baking or snacking.,Colorful and child-friendly gardening tools for little hands.,52,Fatz
Sweet Potato Chips,,fda6cc1c-a097-46f2-ae08-4a739b137da6,Books,2025-06-05,,,Ebert Inc,44705,123,"Deliciously crunchy sweet potato chips, seasoned to perfection.",Marinated chicken thighs with smoked paprika for a smoky flavor.,18,Jabbercube
Dog Collar,Snaptags,44827adb-32c7-4cc8-b79f-cb7eedf1af40,Garden,2025-04-10,15.99,Yihe,"Trantow, Mosciski and Fritsch",62735,145,Adjustable dog collar with personalized tags.,Efficient juicer for fresh fruit and vegetable juices.,180,Kanoodle
Dark Chocolate Almond Butter Cups,Buzzbean,87a39812-68f1-408e-a63f-14dc9cef7ce0,Movies,2026-01-21,4.99,Aragarças,Shields-Reynolds,68320,9,Rich almond butter encased in dark chocolate.,Frozen cauliflower rice blended with mixed vegetables and seasonings.,262,Edgepulse
Buttermilk Pancakes,Kwimbee,,Automotive,2025-08-21,3.99,Vykhino-Zhulebino,Rohan and Sons,38946,37,Fluffy pancakes with buttermilk flavor.,"Tangy green salsa made with tomatillos, perfect for tacos.",,Podcat
Spinach Artichoke Dip,Flashspan,02be0659-fa8c-4ede-9bcf-1ec159791598,Baby,2025-01-26,4.99,Sélestat,"Cronin, Bernier and DuBuque",27765,109,"A delicious creamy dip featuring spinach and artichokes, perfect for parties.","Fresh button mushrooms, great for cooking.",296,Browsecat
Portable Air Compressor,Digitube,f36c28d9-ddb1-4282-ad41-775747d32c72,Grocery,2025-06-08,,Čakovec,,94033,176,Compact air compressor for inflating tires and sports equipment.,,,Jetpulse
Dog Training Clicker,Mynte,d4c9eff6-6d26-4896-bf24-40e4da65a7a0,Kids,2025-08-23,5.99,Mengzhai,Hegmann-Davis,74361,89,Training tool for reinforcing commands and behavior in dogs.,Comfortable camping mattress that inflates automatically.,57,Bluezoom
Cheddar & Bacon Potato Skins,Flashset,4662766f-504e-40d2-9649-e462721e20e0,Games,2025-06-24,7.49,Xêgar,"Dooley, Schultz and Renner",78113,66,Gourmet potato skins loaded with cheddar cheese and bacon.,Soft silicone earbud covers for comfort and fit.,56,Podcat
Folding Exercise Bike,Thoughtblab,,Baby,2025-10-19,199.99,Seixal,,84502,16,Space-saving bike for indoor workouts.,Quote wall art to inspire and motivate.,177,Eare
Cocktail Shaker and Mixing Glass Set,Twimbo,,Automotive,2026-02-09,39.99,Pagelaran,,23580,234,Complete set for mixing cocktails at home.,"Crispy sweet potato fries, perfectly seasoned and baked to perfection.",110,Thoughtworks
Chino Shorts,Blogtag,,Home,2025-03-01,34.99,Bom Jesus da Lapa,"Heaney, Lebsack and Hansen",32875,256,Classic chino shorts in a versatile color for summer adventures.,,,Aibox
Pasta Salad Kit,,3e096e54-8a66-49ed-a43c-76bade28ff8c,Jewelry,2025-11-18,,,Rolfson LLC,74876,106,All-in-one kit for making pasta salad easily.,"A mix of fresh raspberries, blueberries, and blackberries.",155,JumpXS
Hiking Boots,Bubblemix,a94e6bd6-0634-474a-a988-23983db13ecf,Sports,2025-05-06,79.99,Alburitel,,56937,288,,Rechargeable water flosser for dental hygiene.,202,Layo
Electric Griddle with Removable Plates,Fivespan,f7cd8f22-cd6c-4b6e-b072-87858a2f03b7,Movies,2025-10-30,59.99,,Berge Inc,57213,8,Non-stick surface for easy cooking and cleaning.,Handheld frother for creating frothed milk for coffee.,248,Meetz
Dark Chocolate Almond Butter Cups,Tagpad,081c3287-f723-4fd2-b5a9-9ee478394eb9,Electronics,2025-08-28,4.99,Tenggina Daya,Kreiger Inc,57742,113,Rich almond butter encased in dark chocolate.,A sweet and spicy sauce ideal for spring rolls or chicken nuggets.,27,Photobean
Travel Mug,Flashspan,,Baby,2025-02-17,18.99,,O'Reilly Group,37519,5,Stainless steel travel mug with spill-proof lid.,Compact coffee grinder for fresh ground coffee beans.,223,Rhycero
High-Speed Blender,Ntags,6fb30111-c896-4221-8e75-50e67267cf59,Baby,2025-03-01,99.99,Krasnaya Poyma,Conroy LLC,62942,84,Powerful blender for smoothies and soups.,"Chickpeas served with olives, feta, and hummus, a healthy meal.",103,Fivespan
Fitness Tracker,InnoZ,7ebdc745-68cb-48c3-ae85-5ed6b3326944,Jewelry,2025-07-28,49.99,Foúrnoi,,55126,250,"Track steps, heart rate, and sleep patterns.",Foldable kneeler that doubles as a seat for gardening convenience.,130,Quinu
Home Cleaning Robot,Flipopia,,Home,2025-12-07,249.99,Tiflet,"Dach, Conn and Rau",23279,211,Automated cleaning robot for hassle-free home maintenance.,Filters allergens and pollutants from the air for a healthier home.,90,Aivee
Fruit & Nut Trail Mix,Lajo,d70f446c-44a4-47e5-8d63-7a84bb0d0cff,Clothing,2025-09-05,4.99,Castleknock,Kozey Group,72353,295,"A blend of dried fruits and nuts, great for snacking.",Portable and lightweight umbrella for protection from rain.,38,Livetube
Adjustable Dumbbells,,,Tools,2025-02-12,249.99,,"White, Mosciski and Marks",9742,91,Space-saving adjustable dumbbells for strength training.,Comfortable gaming headset with surround sound.,85,Jaxnation
Vegetable Quinoa Bowl,Photobean,,Electronics,2026-01-02,5.99,Ise,Mueller-Dickinson,97078,144,"A frozen meal featuring quinoa and mixed vegetables, ready to heat and eat.",,284,Tagopia
Mini Air Purifier,Eimbee,f1137246-761d-4209-8e37-4ac503f6df1e,Games,2025-08-13,49.99,Bayabas,,,161,Battery-operated air purifier for small spaces.,Gluten-free bread mix made with almond flour.,114,Npath
Luxury Yoga Mat,Skalith,0df3cb34-4f88-4a8c-af62-7c068a2b8970,Beauty,2025-12-15,39.99,Jagiełła,Ankunding LLC,,271,"High-density, non-slip yoga mat for stability and comfort.",Suction cup bird feeder for close-up bird watching.,213,Minyx
USB Desk Fan,Jabbertype,6ce7323f-34af-4fff-afa0-db101a994ffb,Shoes,2025-06-30,14.99,Nasilava,Zboncak Inc,79576,73,Compact USB fan for personal cooling.,Safety collar with flashing lights for pets during night walks.,72,Avavee
Gardening Tools Set,Jabbertype,9ef130c1-f238-46d3-9354-a23f7d6337f3,Baby,2025-08-25,45,Tromsø,"Beier, Windler and Stiedemann",93317,8,Complete set of gardening tools for outdoor tasks.,Adjustable laptop stand for better ergonomics.,192,Leexo
Ultra-Thin Laptop Sleeve,Feedspan,5c0b957e-0f65-4831-9c4f-c35002973aad,Music,2025-04-23,19.99,,Hettinger and Sons,,63,Sleek and protective sleeve for laptops and tablets.,Wearable device to track fitness activities and heart rate.,70,Pixope
Electric Can Opener,Rooxo,250457b1-c62f-499b-9a12-caad3de1059d,Jewelry,2025-07-15,29.99,Erbil,Herzog-Rutherford,66937,264,Automatic can opener for easy meal prep.,Soft oatmeal cookies with maple and pecans.,87,Jayo
Stuffed Bell Peppers,Realcube,2cbd51aa-f9ba-4d80-9362-7db1964943c7,Outdoors,2025-03-03,5.99,Liquan Chengguanzhen,Lebsack Group,4047,283,Bell peppers stuffed with rice and vegetables,"Sweet and tart dried cranberries, great for salads and baking.",24,Yabox
Pretzel Bites,Wordware,4a59cb50-0161-4b97-9064-84b94e2257c7,Movies,2026-01-27,4.99,,Rogahn Inc,50801,242,,"Crunchy peanuts coated in honey, perfect for snacking.",161,
Bike Repair Tool Kit,Livetube,1a90baae-f997-416f-8c55-4a9f7ab529d3,Music,2026-01-31,29.99,Bileća,,,5,Essential tools for bike maintenance and repair.,Classic wooden building blocks for toddlers.,167,Kwinu
Savory Italian Herbs,Fadeo,7ec86ed5-8b09-44df-9417-059b76aa39ea,Games,2025-12-09,2.99,Sapporo,Carter Inc,64544,93,A blend of dried Italian herbs for cooking.,,22,Meeveo
Strawberry Fruit Spread,Ainyx,,Movies,2025-02-07,3.59,Saint-André-Avellin,Flatley-Heller,85852,51,Natural fruit spread bursting with real strawberry flavor.,Frozen chicken wings with garlic parmesan sauce.,44,InnoZ
Collapsible Camping Cup,Youtags,52c4cd2a-9da1-4ec2-ac58-51840f0a5f2a,Electronics,2025-02-02,9.99,Zevgolateió,"Emard, Kemmer and Balistreri",62516,15,Space-saving cup that folds flat for easy storage.,,,Vinder
Plant-Based Protein Bars,Ntags,f8b8c47e-4734-4301-845a-f352b0f9f015,Home,2025-09-22,,Xinzhuang,Sauer-Funk,30974,80,Nutritious protein bars for on-the-go snacking.,Assorted herbal tea bags for relaxation and wellness.,119,Plajo
Compact Shoe Rack,Yozio,,Health,2025-04-02,,Cilebang Satu,Orn-Runte,43939,77,Space-efficient shoe rack to keep entryways organized.,Savory bacon jerky coated with maple flavoring.,273,Digitube
LED Desk Light,Thoughtstorm,b7de9313-967f-44ae-a15f-1773da1e7783,Clothing,2026-01-23,,Pedaringan,Schmitt-Olson,35227,2,Adjustable LED desk light with brightness settings.,"Fresh button mushrooms, great for cooking.",159,LiveZ
Maple Cinnamon Almonds,Leexo,a61fe329-1441-42fb-9db6-a4302723e21e,Computers,2026-01-11,4.29,Gaowu,Gulgowski LLC,93827,246,,Absorbent training pads for puppies and kittens.,140,Thoughtbeat
Cheesy Broccoli Soup Mix,Meeveo,e0a53a90-60cb-478e-9846-60e97c191ddc,Beauty,2026-01-02,2.99,Bjästa,O'Conner Group,80120,283,Just add water for a hearty cheese and broccoli soup in minutes.,"Rich spaghetti sauce, a perfect pasta sauce.",138,Edgeclub
Coconut Milk Yogurt,Thoughtmix,,Games,2025-08-24,2.99,Usogorsk,,49631,216,Creamy yogurt made with coconut milk,"Hearty chili made with beans and vegetables, a savory meal option.",17,Yata
Basic V-Neck T-Shirt,Blogtag,,Electronics,2025-03-22,19.99,,,,115,A staple v-neck t-shirt that pairs well with anything.,Durable jump rope with built-in counter for workouts.,,Buzzbean
Avocados,Devbug,f8e9d9e7-6b49-46c5-82c9-d98e0774929e,Computers,2025-06-17,,,,79090,255,"Fresh, creamy avocados ideal for salads and guacamole.","A healthy oil extracted from avocados, ideal for frying and salads.",276,Flashset
Puzzle Mat,Thoughtstorm,267ec210-ef7d-47a3-a385-b1eb8284233d,Industrial,2025-03-06,22.99,Lyubokhna,Jerde-Walker,89418,218,Foldable mat for jigsaw puzzle assembly.,,270,Meevee
Olive Oil,Browsecat,3b4c18d7-abb5-4cba-a9e8-b70251370e39,Movies,2026-01-09,7.99,Juxing,Roob-Luettgen,7422,154,,"Nutrient-rich broccoli, easy to add to any meal.",247,Dabtype
Vegetable Pizza Rolls,Photofeed,79436c96-c324-48fe-bb27-c91889b94b3e,Baby,2025-10-29,,,Mertz-Kuvalis,4211,253,"Frozen pizza rolls filled with vegetables and cheese, perfect for snacks.",,297,
