Name,Manufacturer,Serial Number,Category,Purchase Date,Purchase Cost,Location,Company,Order Number,Quantity,Notes,Model Number,Min Qty,Supplier
Portable Hammock Swing,Dynazzy,cb131b9a-df60-49e1-9d46-377b719adf34,Health,2025-12-05,59.99,Krzyżowice,"Johnson, Aufderhar and Okuneva",84477,247,,Eco-friendly solar lights for pathways and gardens.,97,
Chickpea Salad,Jayo,6f5a182b-3175-493f-81c9-58387d077808,Garden,2025-02-06,,Xihuaiba,"Bogisich, Beatty and Stiedemann",69615,71,A ready-to-eat salad made with chickpeas and veggies.,Microwaveable heat pad for soothing muscle aches.,282,Eabox
Children's Science Experiment Lab Kit,,,Industrial,2025-05-07,29.99,,Borer-Sanford,60979,299,STEM-based kit for kids featuring cool science experiments.,Removable wall art stickers for home decoration.,138,Latz
Fitness Jump Rope,Skipstorm,c00ffc68-52b1-4dc6-ab7e-e2b9ae7b388f,Outdoors,2025-07-30,15.99,Concepción,Lang LLC,,227,Durable jump rope for cardio workouts.,Flexible LED lights for creative home lighting designs.,253,Dynava
Sous Vide Cooker,,07d7c75b-0b39-4314-80f4-efb7e1e122d3,Grocery,2026-01-07,79.99,Montréal-Est,,75594,210,Precision cooker for perfect sous vide cooking.,Savory bacon jerky coated with maple flavoring.,,Divavu
Mini Hand Gesture Drone,Skippad,8e112253-a7f0-4260-881d-0bac46168ca0,Music,2025-02-04,29.99,Luoping,"VonRueden, Lind and Heaney",,271,Toy drone that flies with gestures and is easy to control.,Beautifully crafted jewelry box with compartments for storage.,,Shuffledrive
Italian Pasta,Gigabox,,Industrial,2025-05-24,2.29,Moita da Roda,Carter-Goyette,68471,281,"Authentic Italian pasta, perfect for a classic meal.",Classic fit blue jeans with a slight stretch for comfort and durability.,8,Bubbletube
Sporty Leggings,Feedbug,,Clothing,2025-04-26,39.99,Sartrouville,Hermiston and Sons,68280,191,Functional leggings designed for maximum comfort during workouts.,Eco-friendly charger that uses solar energy for powering devices.,250,Skynoodle
Desk Organizer Set,Twinder,d31af84f-2951-46f1-85c3-34885370bee1,Grocery,2026-01-12,29.99,,,82764,198,Stylish desk set to keep your workspace tidy and organized.,Colorful building blocks for creative play.,103,Skalith
Noise-Canceling Headphones,Blogtags,,Movies,2025-11-10,,Yuanquan,Schowalter Group,95315,159,High-quality headphones that block out external noise for immersive listening.,Compact electronic drum kit for musicians of all levels.,216,Abata
Self-Adhesive Wallpaper,Gabcube,dfbd13ad-e425-4ed7-9463-0237517c6b84,Garden,2025-06-01,34.99,Francisco Villa,,85449,222,,Personalized calendar with your favorite photos.,154,Yata
Heavy-Duty Utility Tote,Quaxo,99b5c857-2577-4383-b1d9-3e224b56e1e0,Beauty,2026-01-15,34.99,Chengxi,"Kozey, Mayert and Shanahan",73832,57,"Large, durable tote bag for shopping and outdoor activities.",Protective goggles for DIY and construction work.,91,Yata
Honey Glazed Carrots,Topdrive,f248afeb-e3d5-41db-99af-21ad7115c97a,Grocery,2025-10-07,3.49,Zhangxi,Schoen and Sons,14787,59,,Non-stick utensils for safe and easy cooking.,280,Bubblemix
Tomato Paste,Skinte,b2bfa85e-f6be-4f03-94f2-6deda6c56462,Movies,2025-06-15,1.29,Diadi,Bradtke-Kohler,,71,"Concentrated tomato paste, great for sauces.",A ready-to-eat salad made with chickpeas and veggies.,48,Kare
Cheese Stuffed Jalapenos,Geba,4dcb8ce6-c65f-44bc-8131-733f69c6940f,Music,2025-07-17,5.99,Ukmerge,Dicki-Stracke,3756,109,"Spicy jalapenos stuffed with cheese, ideal for appetizers.",Rechargeable electric razor for a smooth shave.,174,Avamba
Almond Crunch Granola Bars,Centidel,,Toys,2025-10-30,,,Baumbach-Dibbert,83128,56,Nutty granola bars for healthy snacking.,Classic cereal made with whole grains and honey.,,Skynoodle
Cinnamon Sugar Mix,Skajo,,Health,2025-09-28,1.49,Zhangdian,"VonRueden, O'Conner and Olson",2221,197,,Charming frame to showcase your favorite photos.,282,Yotz
Crispy Potato Tots,Skinder,,Movies,2025-12-29,3.69,,Deckow-Hermiston,34833,162,"Golden brown potato tots, crispy on the outside and fluffy inside.","A natural sweetener made from coconut sap, a healthier alternative to sugar.",52,Fiveclub
Smart WiFi Plug,Kazu,e8e4d858-fee3-4476-b0ee-62f2717df79b,Grocery,2025-11-10,19.99,Kedung,"Waters, Cartwright and Johnson",94101,133,,Fun lunchbox for kids with a sturdy design.,37,Vidoo
Smart Light Bulbs,Skyvu,2c7f1342-816d-43eb-a8e3-2969ded426f1,Health,2025-06-26,34.99,Nagykanizsa,"Hoppe, Kerluke and Wilkinson",64126,235,Color-changing smart LED bulbs compatible with Alexa.,"Crisp and sweet Honeycrisp apples, freshly picked.",231,Yakijo
Coffee Maker,Youbridge,786be1ad-02c6-417c-9937-052761fa0016,Outdoors,2025-11-19,,Kolokani,,46232,263,Single-serve coffee maker with a built-in grinder.,High-density foam roller for muscle recovery.,14,Yakitri
Pet Water Bottle,Skajo,ebb2c525-3227-4e00-8c35-f239c1f4554a,Home,2025-06-15,,El Cocuy,Cormier and Sons,,141,Portable water bottle for pets when traveling.,Battery-operated blender for smoothies on the go.,290,Midel
Digital Camera,Buzzster,0f25ea04-f190-4215-8b4e-33b997576c6e,Automotive,2025-02-15,299.99,Aygek,Heller-Hermiston,50112,293,Compact digital camera with 20MP resolution.,Light and fluffy popcorn coated in aged white cheddar.,281,Jetwire
Ginger Snaps,Jabbersphere,,Music,2025-08-08,,Kuliyapitiya,"Hoeger, Dicki and Emmerich",18279,125,Spicy ginger cookies that are crunchy and delicious.,"All-in-one tool for measuring soil moisture, light, and pH.",,Tagopia
Italian Herbal Seasoning,Lajo,a6e938c7-d647-41c0-8167-53031f3904fa,Garden,2025-05-13,1.99,Xinzhou,Swaniawski-Feeney,50002,18,A fragrant blend of Italian herbs for pasta sauces and marinades.,Cozy throw blanket perfect for adding warmth to your home.,265,Zazio
Multi-Functional Rice Cooker,Feedmix,e35cc1e8-ad27-41d0-acfd-73cd2ba7fd2f,Sports,2025-02-14,,Ipaba,,43277,42,,Retro arcade machine for classic gaming.,,Centimia
Sweet and Spicy Barbecue Sauce,Photospace,9d082fbe-68ed-417e-ac37-a9f92d167efd,Kids,2025-09-12,3.99,Noyon,"Langosh, Dare and Fisher",77488,275,A flavorful barbecue sauce with a sweet and spicy kick.,Juicy burger patties made with grass-fed beef,87,Gevee
Salsa,Skibox,60cf5b90-439d-4b0d-8d2e-769972d6ee10,Baby,2025-07-16,3.49,,Marvin and Sons,,84,"Fresh and zesty salsa, perfect for nachos.",Water bottle designed to infuse flavors from fruits.,122,Skilith
Cinnamon Raisin Bread,Voonte,3312436d-15db-4295-9445-9629d98cb8cc,Baby,2025-09-27,3.79,,Ward-Schaefer,,207,"Sweet bread with cinnamon and raisins, great for breakfast or snacks.",Durable gloves with built-in claws for digging and planting.,209,Mycat
Spaghetti and Meatball Dinner Kit,Brainsphere,,Outdoors,2025-06-07,7.99,,Turner Group,21066,183,"All-in-one meal kit including pasta, meatballs, and sauce for a quick dinner.","Freshly baked rustic bread, perfect for sandwiches or dipping in olive oil.",78,Nlounge
Cocktail Shaker Set,Feedfish,947d97f0-64b5-4f20-ae98-6a36a27c7214,Kids,2025-08-16,,Alquízar,,80336,15,,High-quality cutlery set for daily use or special occasions.,158,Livepath
Sliced Strawberries,Gabspot,bb66e10b-f841-40c2-83e2-3d689ae63a41,Home,2025-03-21,4.99,Chubek,Skiles-Terry,14402,185,,Soft and chewy bar packed with protein and cinnamon flavors.,76,Meevee
Customizable Photo Calendar,,6f45e650-e2c8-4513-824a-c1d230428758,Automotive,2026-01-13,19.99,Verbivka,,,110,Personalized calendar with your favorite photos.,Classic wooden puzzle game for kids and adults.,118,Ooba
Nature Explorer Lens Kit,Tazzy,c865622c-4b1d-434d-9b50-875a74d5cc9b,Health,2025-06-28,19.99,,Kertzmann-Schmitt,,15,Magical lens kit for kids to explore the outdoors.,,76,Meezzy
Kids' Science Experiment Kit,Yakijo,d977158a-3877-489f-9618-96be5af1d4b3,Kids,2025-11-22,29.99,Ermelo,Paucek-Russel,4830,238,Engaging kit with science experiments for children.,Chic slingback sandals for a relaxed summer vibe.,193,Jaxworks
Portable UV Sterilizer,Roombo,290c2b52-f1aa-4e03-827b-e179d366acee,Garden,2025-08-19,19.99,,,25049,146,Compact sterilizer for disinfecting small items.,"Soft and delicious garlic-infused flatbread, perfect for dipping.",39,Zava
Noise Reduction Headphones,Jaloo,,Kids,2025-02-03,39.99,,,54789,210,Passive noise reduction headphones for focus.,Variety pack of sticky notes in different colors and sizes.,54,Skinder
Breathable Face Mask Set,,,Outdoors,2025-11-05,14.99,,"Crona, Considine and Blick",54221,10,Comfortable and reusable face masks in different styles.,"Fresh baby spinach leaves, great for salads and smoothies.",285,Devpulse
Lightweight Travel Backpack,Flipbug,a67b5b32-31bf-4726-8c49-3282f6546711,Beauty,2025-12-12,,San Pedro Zacapa,,29221,6,Compact and portable backpack for day trips and travel.,"Creamy, dairy-free Alfredo sauce",279,Mudo
Organic Green Tea,Oloo,8fb43af7-b3d2-484d-841c-c77b74bd3d76,Health,2025-05-23,4.29,Jiaoxie,"Fadel, Hodkiewicz and Gislason",12378,98,Delicate green tea leaves for a refreshing beverage.,,81,Yodel
Garlic Herb Cream Cheese,Oyoba,,Clothing,2025-01-10,2.99,Puteaux,,17792,230,Spreadable cream cheese blended with garlic and herbs.,Ergonomic mouse designed for gamers with high DPI.,21,Quinu
Insulated Sport Tumbler,Blogtag,571123df-e97f-4b18-b812-5bb1b719f31d,Outdoors,2025-02-25,22.99,Ejigbo,Gutkowski and Sons,55521,258,Vacuum-insulated tumbler for beverages on the go.,Colorful and child-friendly gardening tools for little hands.,151,Agivu
Sesame Noodles,Midel,8470bbc8-212c-4d7a-92c6-535691214768,Movies,2026-02-09,5.99,Kista,,69486,43,"Chilled noodles dressed in sesame sauce, ready to eat.",Comfortable pet carrier for travel and vet visits.,70,Vitz
Whole Roasted Chicken,Ntags,5cf2b662-8d68-4e97-9e64-8e7a84ab2075,Computers,2025-03-07,9.99,Al ‘Azīzīyah,Lang-Bailey,78182,251,"Seasoned and roasted to perfection, ready to eat.",Soft glow night light for children's rooms or bedside.,32,Pixonyx
Car Phone Mount,Kanoodle,6aa3890a-bb2e-461a-a9c6-ab9022515f58,Shoes,2025-09-10,15.99,Balitai,"Reinger, Hodkiewicz and Toy",91041,256,Adjustable phone mount for car dashboard.,Portable fire pit for backyard gatherings.,237,Trunyx
Cucumber Relish,Yodel,,Clothing,2025-12-18,3.39,,Swift LLC,7037,203,"Sweet relish made from cucumbers, perfect for sandwiches.",Salsa made with fire-roasted tomatoes for an authentic flavor.,71,
Eco-Friendly Disposable Plates,Mycat,44be4089-3703-419a-8e3c-dc5b2006f488,Home,2025-03-30,22.99,Xintang,Connelly and Sons,,167,Compostable plates suitable for various occasions.,Thermos that tracks your water intake and temperature.,60,Flipbug
Smoky BBQ Jackfruit,Trudoo,a6a79e15-a757-457e-9154-3632bd72c638,Outdoors,2025-02-10,,,,49846,45,Pulled jackfruit in a smoky BBQ sauce for a tasty vegan dish.,"Creamy, dairy-free Alfredo sauce",97,Talane
Wireless Charger Stand,Youspan,,Garden,2026-01-08,,Xiachu,"Leannon, Baumbach and Kovacek",61420,297,Convenient charging stand for smartphones and devices.,Creamy Greek yogurt infused with raspberry and vanilla flavors.,99,Yombu
Coffee Maker,Vimbo,cd6a7c1d-2362-448d-b08f-174cc052a6c2,Sports,2025-07-29,89.99,Tuchomie,"Borer, Bergnaum and Fritsch",26936,145,Single-serve coffee maker with a built-in grinder.,Complete set to brew coffee with different methods.,250,Youtags
Chocolate Chip Cliff Bars,Eimbee,,Garden,2026-02-06,2.49,Mahong,,,25,Nutritious energy bars packed with chocolate chips.,Savory sauce for vegetable and meat stir-fries.,290,Kwinu
Trail Mix (Deluxe),,a8da2b36-67e6-4cac-8c94-901f95d7b85c,Electronics,2025-08-21,,L’govskiy,"Rutherford, Douglas and Klein",96785,254,"A delightful mix of nuts, fruit, and chocolate.",Eco-friendly soy candles with a variety of scents.,241,Latz
Olive Oil,Yabox,0f9be4d3-3fb2-4319-9f95-585f26e7f482,Music,2025-03-24,,Kafr Zībād,Franecki and Sons,45002,198,"Extra virgin olive oil, ideal for cooking and salads.",Portable battery pack to charge laptops while on the move.,145,Browsedrive
Kids' Educational Tablet,Twinte,06f42881-500a-4346-a44d-2b31d2a44884,Electronics,2025-10-24,,,,23594,289,Learning tablet with kid-friendly educational apps.,"Crispy chips with a sweet twist, perfect for dipping.",294,Jaloo
Dishwasher Safe Cutting Board,Cogilith,e4e5f72d-f03b-4e3d-b492-a9844b14bacd,Toys,2025-05-01,22.99,Tungao,"Predovic, Sawayn and Champlin",95330,26,Eco-friendly cutting board that is safe for dishwashers.,Durable boots designed for outdoor hiking and activities.,266,Voolia
Fleece Hoodie,JumpXS,227af2c9-7f52-4569-a86d-99f513b8bdd0,Beauty,2025-04-04,,Hexing,,,102,Ultra-soft fleece hoodie for warmth and comfort during chilly days.,Individually packaged bars made with dried fruits and nuts.,18,Mybuzz
Throw Pillow Covers,Roomm,9aa40c7a-37d0-4830-ad63-d3533d940002,Garden,2025-12-06,22.99,,Maggio and Sons,12854,136,Set of decorative pillow covers to enhance your home decor.,Compact electric scooter for commuting and short trips.,80,Demimbu
Marinated Artichokes,Oodoo,,Grocery,2025-10-25,3.79,Karakul’,Welch-Lemke,6552,175,Artichoke hearts marinated in herbs and oil.,Crunchy granola with maple flavor and almond pieces for breakfast.,56,Yata
Cauliflower Rice Stir-Fry,Zooveo,,Kids,2025-03-11,4.99,,Gutkowski-Krajcik,29916,63,Frozen cauliflower rice blended with mixed vegetables and seasonings.,Compact electronic drum kit for musicians of all levels.,96,Twitterlist
Pineapple Teriyaki Chicken Mix,Jayo,eaf14152-2a89-4a82-a50a-4a6a0adf4f85,Automotive,2026-01-10,6.99,Oslo,O'Connell-Treutel,,61,A perfect blend of pineapple and teriyaki for stir-fry.,Single-serve coffee maker with a built-in grinder.,116,
Nature Explorer Lens Kit,,255ffd7a-2352-46a1-a932-bc1431281fc1,Kids,2025-05-12,19.99,Espargos,Hudson-Hansen,,204,Magical lens kit for kids to explore the outdoors.,Frozen cauliflower rice blended with mixed vegetables and seasonings.,300,Gigashots
Mini Cordless Vacuum Cleaner,Edgeblab,,Baby,2025-07-13,45.99,Tidili Mesfioua,"Hettinger, Witting and Ward",16483,3,Handheld vacuum cleaner for quick and easy cleaning.,"Instant oats with a savory twist, such as herbs and spices.",138,Youopia
Electric Ice Cream Maker,Lazz,a7069f20-bc1a-4675-a8bf-080ce3204bb9,Garden,2025-11-09,59.99,,Von-Gerlach,1285,10,Make delicious ice cream at home with this user-friendly machine.,"Assorted sliced cheese, perfect for sandwiches.",120,Shuffledrive
Italian Sausage and Peppers,,c3c437a7-a1d4-41c6-a739-68557389eae0,Baby,2025-08-10,8.99,Quimper,Spinka-Stroman,29179,155,A flavorful blend of Italian sausage with sautéed peppers and onions.,,27,Ntag
Adjustable Height Standing Desk Converter,Dabshots,651763e4-bdc2-4dac-b817-22c50b5f391b,Music,2025-10-16,89.99,,,71331,105,,Simple tool to train your pet with positive reinforcement.,269,Gigaclub
Two-Tier Fruit Basket,Einti,461070d5-b4d2-4dab-8e8d-abed0a71dfe4,Computers,2025-06-20,29.99,Tha Muang,,16650,22,Stylish fruit basket for kitchen or dining room.,,124,Zoombeat
Adjustable Pet Feeder,Dazzlesphere,4955879e-8547-4421-95f3-c860aa660354,Sports,2025-04-05,39.99,Banjar Sedang,Dooley-Terry,78987,188,Convenient feeder that adjusts to your pet's height.,"Sweet and crisp apples, perfect for snacking.",67,Youspan
Nutty Trail Mix,Buzzbean,2ba69c91-49a4-4c96-a2b3-49d554d1e2b0,Sports,2025-09-04,4.29,Hepo,Powlowski and Sons,51234,274,"A blend of nuts, seeds, and dried fruits for snacking.",Compact hose reel to keep your garden tidy.,293,Jabberbean
Tennis Racket,Dablist,,Movies,2025-03-21,89.99,Liuhou,Lowe Group,7136,111,Lightweight tennis racket for beginners and advanced players.,Eco-friendly bamboo holder for toothbrushes.,148,Oyoba
Spicy Thai Chili Sauce,Devbug,,Beauty,2025-11-24,3.29,,Mohr and Sons,,162,,"Lightweight, expandable hoses for easy handling.",218,Roodel
Wrap Front Midi Skirt,Vitz,e007ee9c-c7a0-448f-adba-92ea228a37ce,Outdoors,2025-11-25,44.99,Gaoua,Lind-Kutch,20002,221,,Training tool for reinforcing commands and behavior in dogs.,257,Fanoodle
Dried Apricots,Zoozzy,36f6849b-fbf6-42db-a195-893037a06830,Automotive,2025-01-29,3.79,Mache,"Kemmer, Schaden and Von",48791,88,"Sweet, chewy dried apricots, great for snacking or baking.",,165,Eidel
Maple Bacon Jerky,Yacero,,Music,2025-08-30,6.99,Dundbürd,,49666,77,Savory bacon jerky coated with maple flavoring.,,,Photolist
Portable Pet Bathing Tool,,4654ac67-96c4-43a8-84f6-82c595d99473,Electronics,2025-03-23,29.99,Halimaung Jaya (F-3),"Mueller, Gutmann and Gleichner",89036,59,Handheld sprayer designed for washing pets easily.,A mix to create a delicious onion dip for parties or snacking.,295,Yacero
Mango Chili Salsa,Midel,4c236df0-f0b2-4317-8eee-7e02202c8dff,Shoes,2025-02-23,4.29,Henglin,,56282,103,"A sweet and spicy salsa made with mangoes and a hint of chili, great with chips or grilled chicken.",Multi-level cat tree for climbing and scratching.,210,
Honey-Balsamic Vinaigrette,Blogtag,44f3489a-a488-4a8e-8e7d-5af8b84675d1,Shoes,2025-08-24,3.39,Jangdam,"Gulgowski, Lockman and Paucek",68567,221,A sweet and tangy vinaigrette dressing for salads.,"Sweet and salty kettle corn, perfect for snacking.",239,
Repair Tool Set for Home Improvement,Yodoo,,Tools,2025-06-30,,,,68402,247,Small toolkit with essentials for home repairs.,Portable car vacuum cleaner with strong suction.,143,Eire
Wine Glasses,Edgepulse,,Kids,2025-10-25,29.99,Cabinteely,,61682,296,Set of elegant wine glasses for special occasions.,,116,
Portable Charger with Solar Panel,Skidoo,,Electronics,2025-11-06,45.99,Bābol,Bogisich-Schulist,83490,134,Eco-friendly charger with a built-in solar panel for outdoor use.,,137,Voonder
Workstation Laptop Stand,Quamba,2e36f7ba-28f9-48ff-87e9-61676cbd3710,Toys,2026-02-11,49.99,Stari Grad,,83199,249,,Creamy chickpea dip infused with zesty garlic flavor.,,Devcast
Herbed Couscous,Dabvine,d1970d0e-c5b6-49b4-9eb6-7f12b5b96f04,Jewelry,2025-04-29,2.49,,,,164,Quick-cooking couscous flavored with herbs and spices.,Mesh drying rack for preserving herbs and flowers.,,Meejo
Mango Chilli Sauce,Skiptube,30ba8c26-8c28-4bd6-ac87-366d78405e33,Baby,2026-01-21,3.99,Dragomer,,67549,48,A sweet and spicy sauce for dipping or glazing.,,,Trudoo
Dish Soap Dispenser,Avavee,7b83a1ba-0725-4978-ba1c-7dcbfffdb0b2,Automotive,2025-10-03,18.99,Qukuhu,"Cruickshank, Bradtke and Brakus",63168,93,Stylish dish soap dispenser with sponge holder.,Comfortable and reusable face masks in different styles.,87,Agimba
Ripped Boyfriend Jeans,Babbleset,fd9e1b2a-edd1-4b22-95d6-4c32e53cd282,Home,2025-05-08,,Hovorany,,31256,89,"Stylish ripped boyfriend jeans for a relaxed, effortlessly cool vibe.",Comfortable pet bed for small to medium-sized dogs.,125,Quimm
Athletic Compression Tights,Kanoodle,f737b3af-f746-464d-83f1-48a7d29a0fba,Tools,2026-02-15,39.99,,"Greenholt, Ratke and Langosh",16690,122,High-performance compression tights designed for optimal support and comfort.,Crispy cheese snacks that melt in your mouth.,,Brainsphere
Cranberry Juice,Skinix,92fa3c27-ba7a-4031-a280-f1a28d22db2d,Books,2025-08-27,,Cantuk Kidul,Rutherford-Miller,40490,201,Refreshing cranberry juice with no added sugar.,DIY kit to convert your smartphone into a mini projector.,58,Riffpath
Ethically-Sourced Coffee Beans,Janyx,81bc340d-03ab-400f-9ada-38a9fe0d3389,Jewelry,2025-09-24,9.99,Palmar de Varela,Stamm-McClure,62158,9,Freshly roasted coffee beans with rich flavor.,"Soft pita bread, perfect for sandwiches or dips.",67,Topiczoom
Wild Rice Pilaf,Blognation,0fbba171-afa7-4153-ae1d-abad808e025a,Movies,2025-01-05,3.79,Soloneshnoye,Rath LLC,616,89,"A mix of wild rice with herbs and spices, ready to serve.",,225,Kwinu
Pumpkin Spice Coffee,Gigaclub,e597b93b-4521-4b27-b6b3-13d9ae69bfca,Sports,2025-02-20,7.99,,Boehm and Sons,,109,"Coffee blend infused with pumpkin spice, perfect for fall.",Decorative table runner perfect for autumn gatherings.,245,Devify
Body Wash,,,Health,2026-01-01,12.99,,"Stokes, Barrows and Wilderman",6212,273,Moisturizing body wash with natural ingredients.,Nutritious bars packed with protein for energy,,Kazu
Peanut Butter Banana Smoothie,Midel,,Sports,2025-08-19,3.99,Tabio,"Mayer, Greenholt and Strosin",59883,140,Smooth and creamy smoothie made with peanut butter and banana.,RFID-blocking slim wallet for cards and cash.,150,Vitz
Portable Phone Charger,Brainverse,ddfd0c20-5f89-4143-a3a2-5734e0ed1bbd,Home,2025-05-25,,,Carter-Hackett,61232,175,High-capacity power bank for charging devices on the go.,Reusable suction cup hooks for hanging items.,21,Voolia
Organic Whole Grain Oats,Skynoodle,980599eb-d4d1-4747-a557-a9362b78dd9f,Clothing,2025-05-29,2.49,Dzięgielów,Larson-Mitchell,72580,4,Whole grain oats that are perfect for breakfast or baking.,Instant-read thermometer for precise cooking temperatures.,,Twimbo
Sun-Dried Tomato Pesto,Mudo,2e17011e-4ebb-46e7-9e29-0f61338ca72c,Clothing,2025-06-23,,Morani,"Harber, Kreiger and Klein",48823,261,,Classic cereal made with whole grains and honey.,291,Teklist
Cranberry Lime Sparkling Water,Trilia,0f676fa3-f0fc-4f74-8c81-410144950f4b,Industrial,2026-01-29,1.5,Pallanchacra,Mante-Corwin,33491,78,Refreshing sparkling water infused with cranberry and lime flavors.,A nutritious shake with rich chocolate and refreshing mint flavors.,160,
Electric Can Opener,Skyndu,317bcade-3c62-451f-a8c1-23cb069eb586,Jewelry,2025-06-25,29.99,,Prosacco-Bergstrom,16974,264,Automatic can opener for easy meal prep.,,136,Oloo
Vegetable Stir Fry Mix,Babbleblab,d03b9765-677c-4bfd-9f21-355fbc950d08,Grocery,2026-02-15,3.29,Hitiaa,Grant and Sons,13029,48,A mix of fresh vegetables for quick stir-fries.,Handy keychain that emits a loud alarm for personal safety.,1,Meevee
Non-Toxic Crayons for Kids,Skinix,5ebf55a3-066b-4c95-af7b-4e636b619d4c,Baby,2025-08-23,10.99,,,52716,206,,Crunchy granola with pumpkin spice flavor.,52,Tagtune
Safety Pin Dispenser,Topiclounge,,Jewelry,2025-12-10,5.99,Heishan,Stracke Group,78692,286,,Tangy whole grain mustard for sandwiches and dressings.,88,Lazz
Silicone Baking Mat Set,Youfeed,085d2dc3-f8fe-46b6-a9e6-11e306fd5776,Sports,2025-08-13,24.99,Zhijiang,Hodkiewicz-Bergnaum,62759,178,,Smooth Greek yogurt infused with vanilla bean flavor.,178,
Party Mini Dress,Skyndu,,Computers,2025-06-24,69.99,Perho,,44278,273,,Comprehensive tool set for gardening enthusiasts.,146,Eire
Portable Laptop Table,Babblestorm,4356fe24-a195-4236-b4d8-77c5c3ed0423,Electronics,2025-08-26,39.99,,,4529,43,Foldable table for working with laptops anywhere.,"Assorted herbal teas, perfect for a warm and relaxing drink.",120,Browseblab
Yoga Strap,Aimbu,a46cae60-fa63-41bc-bce3-899b45f26937,Home,2025-12-07,,,"Macejkovic, Vandervort and Stehr",53800,298,Durable yoga strap for deeper stretches.,"Creamy mayonnaise, perfect for salads and sandwiches.",182,Ooba
Lentil Soup (canned),Riffpedia,,Shoes,2025-09-06,,Lomba do Loução,"Swaniawski, Schmitt and Franecki",24441,142,Hearty lentil soup for a quick meal.,Finely ground almonds for baking or cooking,,Aibox
Garden Vegetable Soup,Divavu,,Music,2025-04-24,3.29,Além,,,256,"A hearty soup filled with vegetables and herbs, perfect for a light meal.","Pre-cooked vegetable fried rice, just heat and serve.",204,Devpoint
Laptop Backpack,Edgeclub,a515690b-78ec-44d1-8216-4656aed7f67e,Home,2025-05-05,69.99,Krajan Gading,Bashirian LLC,,295,Water-resistant laptop backpack with multiple compartments.,,100,Muxo
Outdoor Folding Table,Yamia,7db2e05b-6604-484c-9231-65c6cbb2afda,Toys,2025-12-14,39.99,Chishui,Erdman Inc,30838,52,Lightweight and portable folding table for camping or picnics.,"Seasonal pumpkin ice cream, perfect for fall.",235,Flashset
Classic Cheeseburger Mix,Photobug,,Music,2025-01-26,5.49,Vellinge,"Anderson, King and Hand",68127,222,,Travel-friendly water bottle for pets on the go.,91,Shuffledrive
Wireless Earbuds,Skalith,14d4eda3-b067-4b6e-a127-bfc42a254364,Shoes,2025-01-26,69.99,,"Hudson, Ernser and Schaden",98270,276,True wireless earbuds with touch control.,Portable ring light that enhances your photos with perfect lighting.,8,Gabvine
Pet Travel Carrier,Ailane,6f8d17a2-28f6-467d-9e57-113f1f17e5ba,Jewelry,2025-03-11,,Aku,,,2,Comfortable carrier for small pets during travel.,Elegant classic pumps that add sophistication to any outfit.,178,Thoughtworks
Pocket Blanket,Meevee,a12535b7-f60d-46b8-89cd-bc3b0c8ce33b,Baby,2025-10-07,24.99,Mar’’ina Horka,Zieme LLC,83668,218,"Compact, waterproof blanket for picnics and events.",A sweet and spicy sauce ideal for spring rolls or chicken nuggets.,121,Divavu
Wireless Smart Plug,Shuffletag,16599fcd-35d3-4c42-aad7-fe3101d55b03,Home,2025-01-27,19.99,San Pedro de Macorís,"Thiel, McKenzie and Anderson",7953,239,Control home appliances remotely using your smartphone app.,Non-stick surface for easy cooking and cleaning.,45,Eadel
Spinach and Feta Wraps,Babblestorm,9ef3d0a5-ec93-4284-bda3-a3d20d843a5a,Toys,2025-07-20,4.99,,"Bailey, Waelchi and Emmerich",13659,279,Whole wheat wraps filled with spinach and feta cheese.,Inspiring cookbook with healthy recipes.,,Babbleblab
Reusable Silicone Food Storage Bags,Fatz,314b33b5-9d48-43c4-8842-b9ed49cac3c5,Music,2025-06-13,,Aginskoye,"Wiegand, Hammes and Bradtke",90876,174,Eco-friendly bags for storing food without plastic waste.,Suction cup bird feeder for close-up bird watching.,57,Realmix
Sushi Rice,Demivee,e61f76ea-12b3-4b4f-8101-7c082f10d554,Toys,2025-06-30,3.99,Ngajum,"Legros, Blanda and Roberts",68370,46,Short-grain sushi rice for perfect rolls.,Versatile puff pastry for pies and pastries.,157,Skilith
Frozen Fruit Medley,,c0fb344c-b238-434c-97a2-6af741958583,Games,2025-07-18,5.99,Bornu Yassu,Nader-O'Reilly,13569,215,,Rich and creamy Caesar dressing for salads and wraps.,119,Oyoba
Almond Quinoa Salad,Roomm,,Beauty,2025-09-10,,Jiuxian,Hagenes and Sons,16554,37,"Healthy salad made with quinoa, almonds, and mixed greens, perfect for a light meal.",Kitchen tool for tenderizing meat to enhance flavors.,,Tanoodle
Beet Salad,Eabox,,Garden,2025-05-30,3.99,,Kling Group,93146,16,"Ready-to-eat beet salad with dressing, great side dish.",Fresh and juicy cherry tomatoes for salads and snacking.,16,Cogidoo
Pineapple Coconut Bars,Youspan,40bc029c-95eb-4308-9726-7b2d2d89eb8f,Sports,2025-02-09,3.79,Tilik,,53061,71,Refreshing dessert bars made with pineapple and coconut.,,184,Yoveo
