Name,Manufacturer,Serial Number,Category,Purchase Date,Purchase Cost,Location,Company,Order Number,Quantity,Notes,Model Number,Min Qty,Supplier
Greek Yogurt Parfait,Kazio,f76abfb1-7ccd-43ba-a26e-9862c44bcd68,Automotive,2025-03-20,4.49,Qiman,"Brakus, Skiles and Spencer",13889,79,"Layered Greek yogurt with granola and mixed berries, ready to enjoy.",Sanitary holder that ensures your toothbrush stays clean.,,Chatterpoint
Chicken Sausage,Bubblemix,94061904-6e8d-484a-a05d-224a051f4ed5,Electronics,2025-12-14,6.99,Bojongaren,Wolf-Gulgowski,,171,"Flavorful chicken sausage, low in fat and fully cooked.",Quick-cooking ramen noodles made with organic wheat.,40,Wikizz
Camping Chair with Cooler,Avamba,61ffac90-702c-426e-8a8b-8f76b330e58a,Jewelry,2025-11-14,49.99,,"Kub, Gerlach and Hilpert",24136,191,Foldable chair equipped with a cooler pouch.,Portable desk that can be adjusted for sitting or standing.,,
Smart Thermostat,Yakijo,d746482c-2dc0-4a73-9b89-2a790d478fb0,Electronics,2026-01-25,149.99,Huangjiazhai,Dach-Cummerata,75035,135,,"Freshly baked rustic bread, perfect for sandwiches or dipping in olive oil.",291,Yozio
Sweet Potato Noodles,Abatz,f456099b-75d6-4a79-91e3-2f6eb7d9ed79,Clothing,2025-06-29,3.79,Situ,Davis-Koss,12441,240,"Pasta alternative made from sweet potatoes, gluten-free and rich in flavor.",A flavorful sauce made with coconut milk and spices.,239,Photobug
Adjustable Pet Grooming Table,Avavee,016e1550-f628-4c4f-8a64-b1ae5b4b70d1,Grocery,2025-06-03,,Kiên Lương,Daugherty-Von,63084,60,Professional grooming table with adjustable height.,,294,Buzzbean
Cork Yoga Mat,Thoughtmix,39b14519-d474-44dc-b0ac-f0eb17b9406f,Tools,2025-01-17,39.99,Ciwidara,Torphy-Mraz,5041,274,Eco-friendly yoga mat made from sustainable materials.,Bluetooth scale that tracks body composition through an app.,178,
Fitness Resistance Bands Set,Tazzy,,Shoes,2025-11-29,34.99,Loo,Will-MacGyver,18310,42,Variety of bands suitable for all fitness levels.,"Shrimp marinated in a honey garlic sauce, ready to cook.",230,Cogidoo
Cordless Electric Screwdriver,Zoonoodle,98406c78-9cb4-4063-94e8-ff3237d23480,Clothing,2025-01-14,39.99,Pathum Thani,,99133,111,Rechargeable screwdriver with multiple bits for DIY projects.,Portable folding camping chair with cup holder.,256,Chatterpoint
Insulated Coffee Mug,Skinix,,Kids,2025-08-25,24.99,Campo Largo,,36573,202,Double-walled mug to keep your drink hot for longer.,"Rich in selenium, perfect for snacking or baking.",14,Trudeo
Nature Explorer Lens Kit,Pixoboo,,Sports,2025-07-28,19.99,Maji,Predovic-Zboncak,15976,13,Magical lens kit for kids to explore the outdoors.,Love-themed molds for creating desserts and treats.,79,
Digital Photo Frame,Skibox,,Kids,2025-11-27,79.99,Itoigawa,Mraz and Sons,,64,Wi-Fi-enabled digital frame for displaying photos.,"Nutty flavored lentils, perfect for soups and salads.",,Fivespan
Vegetable Stir Fry Mix,Jatri,47821fb3-12dc-4488-8949-1ae81e45951a,Books,2025-09-07,3.29,Changnyeong,"Macejkovic, Kautzer and Runolfsson",,159,A mix of fresh vegetables for quick stir-fries.,Creamy dessert made with rice and cinnamon.,72,Skajo
Cushion Covers,Realcube,4f97ad95-9028-4e49-af31-4fd46ad334b9,Music,2025-09-25,,Balitai,,24702,292,Set of decorative cushion covers for home decor.,Frozen chicken wings with garlic parmesan sauce.,119,Devify
Fresh Strawberries,,363a71f1-349d-4856-84b6-c686d7cbcdc5,Baby,2025-07-22,3.99,Malá Strana,Cruickshank and Sons,36723,221,,"Assorted herbal teas, perfect for a warm and relaxing drink.",26,Yabox
Gardening Gloves,Realbridge,036fc66f-47e1-4d17-ae13-b88e752b35b1,Electronics,2025-04-02,15.99,Huangbei,Pfannerstill-Rempel,,254,Durable gardening gloves with reinforced fingertips.,"Flavorful mustard with a tangy kick, perfect for hot dogs and sandwiches.",283,Meemm
Non-Stick Baking Sheets,,b1a3f2f8-0854-4769-9142-ad60701a4f94,Clothing,2025-05-09,29.99,Hasaki,Hilll-Spinka,59715,39,Set of baking sheets for effortless baking.,,90,
Coconut Curry Lentils,Skyvu,,Sports,2025-05-09,5.79,Miastko,,53594,33,,Instant mix for creamy vanilla pudding.,233,Feedmix
Organic Quinoa Chips,Topicshots,2aa4f659-2746-4e95-9f4d-80bb88f13a06,Home,2025-03-03,3.99,Yelkhovka,Willms Group,,121,"Light and crispy chips made from quinoa, ideal for dipping.",Peel and stick wallpaper for easy home decor changes.,258,Browseblab
Organic Chia Seeds,Flashpoint,,Jewelry,2025-03-30,7.99,Nabire,Abernathy and Sons,32707,129,Nutritious chia seeds great for smoothies,"Creamy dip made with real onions and spices, great for chips and veggies.",195,
Hibiscus Herbal Tea,Quire,84454a02-71da-4427-9fba-3f85af8d59c9,Kids,2025-02-06,,,Deckow Group,29099,241,"Floral and refreshing herbal tea, great hot or iced.",Fiery hot sauce made with fresh habaneros and spices.,193,Buzzshare
Active Racerback Tank,Agimba,95c8f1b3-1c9f-4145-ad9a-e2be42b6c8b0,Tools,2025-05-11,,,,94935,113,Lightweight and moisture-wicking racerback tank for workouts.,"A mix of nuts roasted with spicy seasonings, perfect for snacking.",49,Voonder
Brussels Sprouts,Wikizz,b2f24a25-7792-455e-97e9-4bc72baa2c3d,Baby,2025-02-10,3.49,,,36940,96,"Fresh Brussels sprouts, great for roasting or steaming.",Compact keyboard for tablets and smartphones.,285,Quatz
Couscous,Tagchat,ba2b9116-4828-4c63-85d9-274e84986441,Home,2025-07-19,2.49,,,87913,84,"Quick-cooking couscous, great as a side or base.",Gentle brush for removing loose fur from pets.,114,Thoughtsphere
Maple Cinnamon Granola,Skinte,3219372b-acae-4f7e-91bd-b2b06caf8700,Industrial,2025-10-27,4.29,Pancur,,10240,283,"Crunchy granola mixed with maple syrup and cinnamon, perfect for breakfast or snacks.",Passive noise reduction headphones for focus.,145,Feedspan
Puzzle 3D Model Kit,Quamba,b80a6b87-0d65-4bb8-9404-04ed6065c93a,Garden,2025-03-29,22.99,Kotadukuh,Armstrong Group,9995,67,3D model puzzle kit for creative builders.,Instant oatmeal cups with blueberries for an easy breakfast.,259,
Camping Chair,Quimba,42bf6536-ba7b-4337-bcd7-fe2fb88c4b98,Music,2025-05-22,29.99,Hongor,Yundt Inc,40742,181,Portable folding camping chair with cup holder.,Nutritious and hearty pasta made from whole wheat flour.,211,Shuffledrive
Puff Pastry,Wikizz,1814df4c-c35b-4108-b008-e195aaf19fa1,Grocery,2025-12-25,5.49,Ratilangi,,,183,Versatile puff pastry for pies and pastries.,"A blend of roasted red peppers and spices, perfect for dipping.",282,Topicblab
Backpack,Eimbee,d6100c9a-84e1-452e-946e-4a52f813c317,Home,2025-12-24,49.99,Yanglong,Braun-Gulgowski,99143,4,Durable and spacious backpack for travel and school.,"Sweet and fruity peach preserves, perfect for spreading on toast.",,Gabvine
Trail Mix (Deluxe),Lazz,75aa7396-451b-43c7-a578-f0b1929d97b3,Baby,2025-06-25,4.59,Panalanoy,Dickens-King,68936,130,"A delightful mix of nuts, fruit, and chocolate.",Set of resistance bands for strength training at home.,274,Photofeed
Garden Hoses with Expandable Features,Browseblab,,Industrial,2025-11-24,34.99,Liverpool,Hettinger-Crona,53939,73,"Lightweight, expandable hoses for easy handling.",Set of brush pens for colorful and creative painting.,122,Wikivu
Honey Sesame Chicken Mix,Chatterpoint,67d6d009-c0b9-48ca-84e2-db47ce0544f2,Clothing,2025-04-10,8.99,Guanzhuang,,,287,A meal kit featuring tender chicken with honey sesame sauce.,"Creamy vanilla fudge, a sweet treat for all occasions.",120,Aivee
Comfortable Jogger Pants,Meedoo,8d5ea1a9-2933-4354-b7e1-a08f0ff45c55,Toys,2025-09-02,,Dulolong,"Schultz, Welch and Lehner",78584,145,"Relaxed fit joggers made from soft fleece, ideal for lounging or workouts.",Set of reusable stainless steel straws for drinks.,224,
Handmade Leather Journal,Jetwire,,Tools,2025-02-20,,Kefar Tavor,Brakus Group,40244,294,Beautiful leather-bound journal for writing and sketching.,,277,Twitterlist
Frozen Mixed Vegetables,Quimba,d5ec4880-0e1d-4e01-8449-7342d486a5cf,Shoes,2026-02-15,,Xinhua,,,273,,Lightweight windbreaker for outdoor activities.,284,
Coconut Granola,Fivechat,8d4d4062-6b2f-4e84-8a4c-3c7d00c14b32,Computers,2025-05-11,4.19,,"Brakus, White and Torphy",,146,,"Instant miso soup mix, just add hot water for a warm meal.",188,Kimia
Tea Infuser Bottle,Jaxnation,,Sports,2025-04-08,19.99,Arue,Padberg-Schultz,92082,88,Bottle with infuser for brewing loose-leaf tea on the go.,Charcoal kettle grill perfect for backyard barbecues.,109,Zoonoodle
Homemade Salsa,Nlounge,201e71d5-a528-4758-800d-25719ff55d23,Health,2025-07-13,3.79,Barobo,"Hauck, Raynor and Quigley",82655,197,,Just add water for a hearty cheese and broccoli soup in minutes.,262,Bubblebox
Free-Range Eggs,Meedoo,7fcee44a-e5bd-42b7-99ca-59032a57b957,Automotive,2025-05-12,,Natakoli,,,187,,Stylish wall art to enhance home decor.,155,Kanoodle
Classic Cheesecake Mix,Chatterpoint,9be0f720-426d-44e1-8674-5e3c5c4d6b52,Computers,2025-05-24,4.99,Tapiramutá,Predovic LLC,11784,37,"A simple, no-bake cheesecake mix to create your own delicious cheesecake.","Large, durable tote bag for shopping and outdoor activities.",121,Muxo
Chocolate Protein Powder,Aibox,b4fba28e-59d0-46b0-9505-04e24382fcc5,Baby,2026-01-20,24.99,Montpellier,Nienow and Sons,20870,267,Rich chocolate protein powder for smoothies and baking.,Natural honey sourced from wildflowers.,68,Topicware
Caramel Apple Taffy,Yacero,90070bb6-48b1-40f7-8846-ac2a050cc8a6,Games,2025-06-24,1.99,Dok Kham Tai,Graham-Kovacek,31588,85,"Sweet and chewy taffy flavored like caramel apples, great for fall.",Decadent tart made with rich dark chocolate.,,Youfeed
Almond Butter Cookies,Midel,a9276cb5-a027-4892-ab93-5adb5b6ff575,Jewelry,2025-06-18,4.49,P’yŏngsŏng,Hessel-Farrell,77424,228,Soft cookies made with almond butter,"Delicious and fully cooked sliced ham, ready to eat.",30,Realblab
Compact Digital Camera,,a1d10864-8232-4cab-baa1-ae84224a260c,Tools,2025-11-18,249.99,Beihe,Halvorson Group,31891,243,High-resolution camera for stunning photos.,Practical cargo pants with lots of pockets for functionality.,194,Wikido
High-Speed Blender,Brightdog,,Movies,2025-10-09,99.99,Huzhen,Kunde-Johnson,,253,Powerful blender for smoothies and soups.,Rechargeable electric wine opener for effortless uncorking.,93,Topicshots
Rechargeable Electric Toothbrush,Feedspan,31c1acec-87eb-4afa-aa6e-5ea93da15124,Electronics,2026-02-04,49.99,Luján,"Predovic, Lakin and Thompson",97352,1,Advanced electric toothbrush for effective cleaning.,"Rich and flavorful chicken broth, great for soups.",4,Dablist
Lentils,Skidoo,70d86350-b95a-4d13-873f-c7182576b2e7,Baby,2025-02-14,2.99,,"Grady, Bode and Price",36519,15,,Journal to record workouts and nutrition.,,
Coconut Granola,Jetwire,d4fcfa09-71d0-4705-9aca-2e9debc4b534,Health,2025-04-13,,Kukoboy,,17235,114,Crunchy granola mixed with coconut flakes.,,218,Npath
Non-Stick Grill Pan,Twinte,56dca47b-ed16-4d18-802a-c732317c0ef7,Industrial,2025-05-27,,,,63489,27,Heavy-duty grill pan for indoor grilling.,Convenient magnetic jars for easy spice storage.,189,
Portable Water Filter,Meetz,1e5ed6f0-2aa5-4ca2-a886-df31673049a8,Toys,2026-01-07,,Houston,Luettgen-Kautzer,20595,25,Lightweight water filter for outdoor adventures.,,193,
Personalized Keychain,Yacero,,Jewelry,2025-02-15,10.99,Badou,"Crooks, Kassulke and Bruen",35536,107,Custom keychain with engraved text.,Automated cleaning robot for hassle-free home maintenance.,227,Myworks
Pizza Stone,Ooba,bf421cb5-90e9-4d5c-8e2c-e63068285239,Outdoors,2025-01-11,29.99,Ambovombe,Zieme Group,,47,Ceramic pizza stone for homemade pizzas.,"A nutritious salad with kale, quinoa, and a zesty lemon dressing.",158,Zoomzone
Ultraviolet Phone Sanitizer,Skiba,35a04a80-2710-4658-bfac-c3d55529c01a,Kids,2025-04-16,,Whittlesea,Jacobson LLC,99549,181,UV sanitizer that kills germs on your smartphone.,Instant-read thermometer for accurate cooking temperatures.,155,Zoonoodle
Sweet Pea Hummus,Zooveo,04166479-d322-49e8-bf54-b62aade98f16,Computers,2025-06-25,,Campo Maior,Witting LLC,20603,168,Creamy hummus made with sweet peas and tahini.,Crispy apple chips drizzled with caramel for a sweet treat.,38,Geba
Pet Bed,Oyoba,99b68302-20e9-426b-8ded-259e3b28ee45,Industrial,2025-11-09,39.99,Camingawan,Weissnat-Runte,6954,76,Comfortable pet bed for small to medium-sized dogs.,Electric rice cooker with multiple cooking settings for perfect rice.,4,BlogXS
Spicy Chicken Wings,Rooxo,,Toys,2025-12-11,9.99,Tempeh Tengah,Greenfelder-Renner,2617,162,"Wide range of flavored wings, perfect for parties or casual snacking.",Oven-roasted potatoes tossed in garlic and parmesan cheese seasoning.,11,
Organic Almond Flour,Aibox,efc563c0-b89a-4ca2-82d1-c4a539cd6807,Books,2025-10-26,6.99,,Hills Inc,26277,102,Finely ground almonds for baking or cooking,Delicious plant-based burger made with organic black beans and spices.,,Talane
Chocolate Protein Powder,Pixoboo,3421c351-85d5-420a-a464-730f7c0f38e3,Home,2025-08-07,24.99,Hovězí,,93406,201,Rich chocolate protein powder for smoothies and baking.,Rechargeable lantern with multiple brightness settings for outdoors.,158,Oodoo
Inflatable Party Cooler,Rhynoodle,,Games,2026-02-12,19.99,Hadyach,Bashirian LLC,,125,,"Creamy and smooth peanut butter, perfect for sandwiches.",146,Wordtune
Electric Toothbrush Holder,Quinu,0a7d2355-145b-4d47-bd91-f897d64eeca7,Tools,2025-03-31,14.99,Shangxing,Wintheiser-Klein,,261,Sanitary holder that ensures your toothbrush stays clean.,Juicy burger patties made with grass-fed beef,240,Shufflester
Chocolate Mint Protein Shake,Youspan,152f4e26-0b80-488a-9ce4-dab51a5b54fa,Grocery,2025-11-23,3.99,,"Wintheiser, Zulauf and Block",86363,75,A nutritious shake with rich chocolate and refreshing mint flavors.,Roasted almonds coated in a sweet maple and cinnamon mixture.,253,Trudoo
Frozen Acai Purée,Livepath,,Health,2025-03-02,6.99,Obo,Baumbach-Altenwerth,,76,Unsweetened frozen acai purée for smoothies and bowls.,A warm and stylish puffer coat perfect for winter weather.,26,Eare
Durable Hiking Boots,Twimm,33d93b80-3f8c-4b42-a78c-854e5f5f16d5,Grocery,2025-05-28,,,"Hansen, Mayer and Hettinger",39956,48,Comfortable and rugged boots designed for hiking.,Essential ingredient for baking fluffy cakes and pastries.,182,Photolist
Garlic Herb Grilled Chicken,Bubblebox,c2d26efd-3656-404b-9461-30b7fce427f0,Games,2026-02-10,8.99,,Boyer and Sons,2285,31,Marinated grilled chicken breasts seasoned with garlic and herbs.,,274,Eire
Herb Seasoned Rice,Yodo,,Music,2025-06-18,2.99,San Francisco,"Wisoky, Stroman and Hane",,148,A flavorful rice side dish seasoned with herbs and spices.,"Crispy fries tossed in truffle oil and parmesan, a gourmet snack.",183,Jetpulse
Under Desk Footrest,Skinix,b7c553e8-3f48-4336-a3c3-8ee8876430d3,Shoes,2025-01-28,,El Playón,Ryan-Lubowitz,67391,256,Adjustable footrest for improved comfort while sitting.,,182,Youopia
Stainless Steel Mixing Bowls,Browsebug,671e66ed-044d-42a0-b018-3a184232b9c9,Sports,2025-06-02,29.99,Cajicá,"Strosin, Rath and Fritsch",38781,177,Set of versatile mixing bowls for cooking.,Roasted Brussels sprouts drizzled with balsamic glaze.,53,Thoughtblab
Wrap Jumpsuit,Skinte,7be15abf-7877-4bc6-ad2c-4176ad1aee17,Industrial,2025-03-22,54.99,Feodosiya,Pouros LLC,73590,298,Chic wrap jumpsuit that flatters the body and is perfect for any occasion.,Eco-friendly charger that uses solar energy for powering devices.,299,Meedoo
Wooden Children's Play Kitchen,Devbug,64e50652-f11b-4cb9-9b17-ffd2de6bcba1,Games,2025-08-04,129.99,Rijeka,"Ratke, Kuphal and Cronin",14853,34,Interactive kitchen set for imaginative play.,Spicy sauce perfect for chicken wings and dipping.,5,Tagcat
Tahini,,,Beauty,2025-06-23,5.49,Åkersberga,Mills-Pacocha,64693,177,,Durable and shatterproof silicone glasses for outdoor use.,262,Edgeblab
Sweet Potato Chips,Jabbersphere,b13e57ca-3df8-4237-8a02-9b14e8e2589d,Computers,2025-12-19,2.99,San Matías,"Bahringer, Reichert and Watsica",8325,46,"Deliciously crunchy sweet potato chips, seasoned to perfection.",Gentle brush for removing loose fur from pets.,177,Dabvine
Stainless Steel Grater,Bluejam,b128c49a-022b-4e74-bacd-b9e256d9a2ad,Beauty,2025-07-26,14.99,Hanau,"Kiehn, Gislason and Greenfelder",,208,Multi-functional grater for cheese and vegetables.,Light and crunchy rice cakes made from organic brown rice.,214,Gabtype
Electrolyte Water Bottle,,142efa93-4e0a-4990-8a92-097d60a49efc,Home,2025-06-22,34.99,Gon’ba,Runolfsson Inc,20001,294,Water bottle that tracks hydration levels and adds electrolytes.,Weighted jump rope that counts jumps and calories burned.,7,Blogpad
Training Soccer Ball,Youbridge,,Beauty,2025-01-27,,,Goyette and Sons,59262,72,Durable training soccer ball for practice.,Prevent water damage with drip trays for potted plants.,266,Cogidoo
Car Escape Tool,Vidoo,986c2cf2-89e0-4827-9741-ae5fc6c042c0,Health,2025-12-26,12.99,Petaling Jaya,"Torp, Lakin and Adams",71325,109,Multi-functional tool for emergency situations in the car.,Trendy high-top canvas sneakers for a stylish streetwear look.,60,
Kids' Building Blocks,,e2bff7ea-cf85-4107-b1ce-105c4268be9c,Jewelry,2025-01-08,19.99,Dongqinggou,,13851,158,Colorful building blocks for creative play.,Delicious homemade style blackberry jam.,63,Jabbersphere
Lemonade Mix,Quimm,,Sports,2026-02-15,,,"Walker, Kassulke and Waelchi",12750,298,Sweetened powder for refreshing lemonade.,,200,Yamia
Solar String Lights,Roodel,,Movies,2025-03-02,29.99,,Zboncak-Kiehn,,254,Eco-friendly string lights for outdoor decor.,Compact projector for movies and presentations on the go.,,Riffwire
Organic Green Tea,Chatterbridge,c6e957ba-3b3a-43cd-8b4d-2d22bb0d7115,Grocery,2025-03-03,4.29,Delaware,"Wintheiser, Schmeler and Morissette",,25,Delicate green tea leaves for a refreshing beverage.,"A delightful mix of nuts, fruit, and chocolate.",,Zoonder
Active Racerback Tank,Gigaclub,2e9ad4fd-8172-48c2-95f6-a67a51c31280,Beauty,2025-04-25,24.99,Huangtu,,,7,Lightweight and moisture-wicking racerback tank for workouts.,"Sweet and juicy strawberries, perfect for desserts.",292,Realfire
Automatic Pet Feeder,Pixonyx,2349d1be-a207-40a0-9478-9ee88a06e2d1,Industrial,2025-01-02,,Nam Kliang,"Pfannerstill, Kessler and Sawayn",65369,78,Programmable pet feeder for scheduled meals.,,170,Digitube
Turmeric Ginger Tea,Vimbo,,Garden,2026-01-05,3.29,Jiazhuyuan,"Hackett, Hand and Hodkiewicz",55808,111,,Creamy vegan mac and cheese made with cashew cheese.,,Photolist
Whole Grain Mustard,Mynte,dd905609-49c3-469e-9581-7780817624b5,Industrial,2025-04-19,3.49,Marinilla,"Vandervort, King and O'Reilly",80084,77,Tangy whole grain mustard for sandwiches and dressings.,Soft and cozy slippers for indoor wear.,250,Digitube
Brussels Sprouts,Skyba,,Health,2025-07-23,3.49,Kabanga,Quitzon LLC,,19,"Fresh Brussels sprouts, great for roasting or steaming.",Countertop compost bin for kitchen waste.,200,Twimbo
Plaid Flannel Shirt,Tanoodle,2dc717c7-2b1d-4ae9-8320-7add23a8d2c5,Garden,2025-07-03,29.99,,Wintheiser and Sons,6766,150,"Soft flannel shirt with a timeless plaid pattern, perfect for layering.",Soft and cozy bathrobe perfect for relaxing at home.,90,Flashpoint
Sriracha Hot Chili Sauce,Twinder,1c718db8-82ea-4721-96e3-f0e982a1ae0b,Garden,2025-01-11,2.99,Llauta,Wiza Group,61490,178,Spicy and tangy chili sauce for adding heat to any dish.,Sweet and savory sauce for marinating and glazing meats or vegetables.,127,Meevee
Paprika,,1048df35-e110-41cd-9d4f-1ac389ae5626,Baby,2025-02-12,1.79,,Satterfield-Keebler,94374,224,,,215,Zoovu
Maple Glazed Carrots,Gabspot,e5952403-3682-4bad-b8e4-a88d1561cc20,Sports,2025-12-25,3.29,Taurage,Jacobs Inc,9968,229,Tender carrots glazed with a sweet maple sauce.,High-quality matcha for making traditional tea or lattes.,30,Eazzy
Bamboo Charcoal Air Purifier Bags,Skibox,e603f1c5-7bf3-4865-af1f-63711cf05f19,Music,2025-11-29,12.99,Quwaysinā,,91748,182,Natural air purifiers to absorb odors and moisture.,Portable folding table for outdoor events.,119,Topicshots
Teriyaki Chicken Skewers,Rhyloo,107fb95d-0781-4cd2-afbb-06428e981867,Beauty,2025-11-26,8.99,Slovenski Javornik,"Schumm, Beier and Prohaska",,77,Grilled chicken skewers glazed with teriyaki sauce.,"Natural pink salt, perfect for seasoning.",283,
Chickpea Snack Mix,Photobug,9cbc9dba-a452-4a4f-9c25-6460e71a37ec,Grocery,2025-12-18,3.49,,,82217,286,"Crunchy, seasoned chickpeas for a wholesome snack.",,256,Skaboo
Chocolate Dipped Fruit,Lazzy,177d79b8-6ab2-4f5c-bc5e-6ededee3a6bb,Health,2025-05-28,5.99,Myaydo,,,78,"Fruits dipped in rich chocolate, perfect for desserts.",Ear protection for shooting and industrial use.,121,Yamia
Stylish Wide-Leg Trousers,Rhynyx,99dac5bc-ef58-4693-9dd2-f7e14d2ddfea,Outdoors,2025-05-04,59.99,Vitória de Santo Antão,,24861,271,Fashionable wide-leg trousers for a chic silhouette.,A stunning lace dress perfect for special occasions.,,Skinder
Surimi Crab Sticks,,f1bd3e21-cf65-41a1-aeea-49f811c6d30e,Beauty,2025-09-05,4.19,Villarrica,"Huel, Mayert and Marvin",,234,"Synthetic crab meat sticks, great for salads and sushi.",,110,Twitterworks
Maple Pecan Granola,,5d1d1f64-93bf-4f26-9eee-c6d8e7135ef9,Jewelry,2026-01-23,4.49,Mawlaik,Balistreri and Sons,71543,272,"Crunchy granola with maple syrup and pecans, great for breakfast or snacking.",Crunchy corn chips flavored with chili and lime for a zesty kick.,,Trudeo
Spicy Beef Taco Mix,Voomm,4455e25b-5c77-4fde-99c3-b12cdba3c073,Sports,2025-05-15,1.99,Volkhovskiy,Koepp-Stehr,39080,289,Easy mix for making spicy beef tacos.,"Lightly salted rice cakes, perfect for a healthy snack.",102,Chatterbridge
Lemon Sorbet,,7ef131b8-87b2-4678-a596-3f3dd198b9c8,Movies,2025-01-17,,,Bernier-Goldner,,117,Refreshing sorbet with a zesty lemon flavor.,Everything you need to create a hearty beef stroganoff.,294,Jayo
Chocolate Fudge Ice Cream,Devpulse,,Games,2025-07-28,,Varkaus,,,173,Rich and creamy chocolate fudge ice cream for dessert.,"High-density, non-slip yoga mat for stability and comfort.",57,Voonyx
Stainless Steel Mixing Bowls,Geba,f0e671a0-6fe6-4111-a701-418747e1bec0,Sports,2025-07-15,29.99,Basar,Rogahn-Legros,,160,Set of versatile mixing bowls for cooking.,Educational tablet designed for preschool-age children.,119,Twiyo
Smart Doorbell,Pixonyx,07c2da79-dd19-41d6-87e4-e375c55548d2,Jewelry,2025-07-14,119.99,Akhaldaba,Murphy-Runte,94724,81,Wi-Fi enabled doorbell with HD camera and two-way audio.,Hands-free waist pack for carrying essentials while walking your dog.,273,Meevee
Cauliflower Gnocchi,Avamba,dadb6b5a-002c-47d9-b3eb-91a141435d3e,Games,2025-11-01,3.59,Manuel Cavazos Lerma,"Mante, Nader and Rowe",35683,128,"Soft and pillowy gnocchi made from cauliflower, perfect with sauce.",Instant noodles with a spicy Thai sauce for quick meals.,156,Quimba
Organic Ramen Noodles,Geba,cf4c7139-9f0a-4f1b-8f83-87e4e3a00497,Home,2025-12-19,2.89,,"Crist, Koelpin and Durgan",35072,160,Quick-cooking ramen noodles made with organic wheat.,Lightweight fishing rod suitable for beginners.,35,Plajo
Children's Backpack,,0fd2c5d9-26d1-42b0-aa10-74f9aeadb58f,Baby,2025-11-14,29.99,Lianghekou,,41078,222,Stylish and functional backpack for school or trips.,Bold graphic hoodie featuring a comfortable fit and soft fabric.,86,Quatz
Ginger Turmeric Latte Mix,Zoonder,a5d95e25-c3eb-4de9-aaeb-95e6323cd142,Shoes,2025-08-09,5.29,Huxi,Marvin Group,65612,198,A warming blend of ginger and turmeric for lattes.,Organizational cubes for easy packing and travel.,282,Bubbletube
Cereal Dispenser with Portion Control,,895b2911-01e5-4217-bf84-96b9fe48c702,Beauty,2025-06-23,24.99,Aparecida,Kulas-Barrows,,105,Maintain freshness and dispense cereal easily.,"A delicious savory quinoa pudding, great as a side dish.",110,LiveZ
Honey Garlic Chicken,Devcast,0a659deb-8d98-4ec0-8200-add775d21e9d,Baby,2025-06-05,8.49,Nanggorak,Kris LLC,62936,69,Tender chicken coated in a sweet and savory honey garlic sauce.,Delicious canned pineapple rings for desserts or salads.,241,Realcube
Organic Spinach,Skynoodle,fb63945d-c42f-4192-afe6-b3b7bec7941b,Tools,2025-01-19,2.99,,,53904,81,"Fresh organic spinach, great for salads or cooking.","A blend of assorted nuts, perfect for snacking or adding to recipes.",181,Mymm
Pressure Washer Accessories Kit,Twinte,e75d69b7-a50e-44a3-b5a8-81870e2d9ec6,Outdoors,2025-05-07,,Concepción,"Feeney, Gislason and Gleichner",84068,200,Essential attachments for pressure washing.,Essential survival gear kit for emergencies.,127,Reallinks
USB Wall Charger,Voolith,b44849a5-5a19-4053-a96a-a34e7ba91f81,Games,2025-10-23,19.99,Jaga,Metz LLC,,299,,Rich and creamy Caesar dressing for salads and wraps.,84,
Mango Chutney,Gabvine,cd487632-2512-4e9d-9720-c2ab8943a553,Books,2025-07-28,3.99,Kamenjane,Cremin-Dibbert,90386,45,Sweet and tangy mango chutney for a flavorful dip.,,154,Photospace
Roasted Garlic Pasta Sauce,Meezzy,d71bbe71-1378-472a-8afc-463179e206cc,Games,2025-12-01,4.99,,,74298,93,A flavorful pasta sauce made with roasted garlic.,A crunchy blend of nuts and pretzels with a spicy kick.,195,Eare
Knitted Infinity Scarf,Viva,9fda6d3c-7b6a-4904-9968-f32ebb6b83ec,Outdoors,2025-09-08,29.99,Xinpu,Ledner LLC,68215,139,A warm knitted scarf to keep you cozy in winter.,"Fresh button mushrooms, great for cooking.",,Voonyx
Organic Baby Carrots,Voonyx,,Music,2025-04-16,2.99,,,1308,235,Fresh and crunchy baby carrots ready for snacking.,Nutritious and hearty pasta made from whole wheat flour.,154,
Quality Chef Apron,Topicstorm,934f2216-7498-42c7-a592-53a044ad4c57,Sports,2025-03-11,19.99,Renko,"Larkin, Boyer and Goyette",77834,273,Durable apron to keep clothes clean while cooking.,A fashion-forward bomber jacket to elevate your casual looks.,,Meejo
Professional Chef Knife,Talane,,Toys,2026-01-25,,,,,204,High-carbon stainless steel chef knife for precision cutting.,"Classic marinara sauce for pasta, pizza, or dipping.",,Photobean
Salt and Pepper Grinder Set,BlogXS,98f75da1-bcb6-47fd-93b7-e70ed37675a6,Automotive,2025-02-28,19.99,Pasirpanjang,,,115,Adjustable grinders for fresh spices at the table.,A spicy marinade perfect for chicken and fish.,4,Einti
